{
  "basis": {
    "active_reader_input_ref": {
      "path": "sources/2026-W33/publication/v2/reader-surface-input-v2.json",
      "sha256": "0b62fd5bab81bc0f8ea80259849fe854e6653f6f375d2e0142258933029ec294"
    },
    "active_revalidation_ref": null,
    "before_graph_digest": "79b9eed442ee38c243c8c03054c8a2495ab21ba49556d50b23b98487478031fd",
    "contract_identity": {
      "pipeline_contract_sha256": "3adfbda22131eac4017ef867aef2ebb2f346f884731c4ea8343e9062392eabd5",
      "pipeline_contract_version": "2.0-rc1",
      "publication_profile_sha256": "99adff93ff443e02bdcce639ce5fc4d4c959ee45a804da70efc4277db57fdddb",
      "publication_profile_version": "2.0-rc1",
      "quality_contract_sha256": "b5b955d524fb438c0f1b2c9490bea1da2083e79028d67a55ca424bbfc20f2958",
      "quality_contract_version": "2.0-rc1",
      "research_profile_sha256": "666f8a064b190ffd35216e26d6fdf2dd0fa932cac7b1b0d6448e262ded77b9a8",
      "research_profile_version": "2.0-rc1"
    },
    "generated_receipt_ref": {
      "path": "sources/2026-W33/publication/v2/validated-source-manifest.json",
      "sha256": "ba351218d9fd34ed6d708e9b9966ecb79777b3af15f52dd3280c51ec0e2b3bc0"
    },
    "preserved_upstream_digest": "776adfdaa5da0a421d9f01a454da95c14a3e3b57c6eb661fb7e9763403879973",
    "renderer_commit": "4114dabc2bfa0808a8b024ce6c6310f3395d6da5",
    "state_ref": {
      "path": "sources/2026-W33/production-state.json",
      "sha256": "460b08721e4baf467bf2919c5935ea0c259758d175611c8332887aa378a1d4b2"
    },
    "validation_checkpoint_ref": {
      "path": "sources/2026-W33/orchestration/v2/checkpoints/DRAFT_COMPLETE.json",
      "sha256": "3047c613279942ff7bf02bc141f15ede46e8393bea325dd0de4e50d1f0e5d57e"
    }
  },
  "issue_id": "2026-W33",
  "proposal_id": "ed-weekly-full-ren-c-v2",
  "proposed": {
    "authoring_input_ref": {
      "path": "sources/2026-W33/publication/v2/editorial-corrections/ed-weekly-full-ren-c-v2/authoring-input.json",
      "sha256": "1842d15ade550c2ad6466ee4efa275c68521dffb45c489717ec01baab686fb0a"
    },
    "change_description": "editorial correction proposal ed-weekly-full-ren-c-v2",
    "proposed_reader_canonical_sha256": "4426e670cbf3473cf5653931a85260347838a64c126add65f0a1d4b639d3749f",
    "proposed_reader_ref": {
      "path": "sources/2026-W33/publication/v2/editorial-corrections/ed-weekly-full-ren-c-v2/reader-surface-input-v2.json",
      "sha256": "4426e670cbf3473cf5653931a85260347838a64c126add65f0a1d4b639d3749f"
    }
  },
  "publication_profile": "WEEKLY_MAGAZINE",
  "research_profile": "WEEKLY",
  "retention_plan": [
    {
      "byte_count": 218,
      "path": ".latexmkrc",
      "policy": "KEEP_IMMUTABLE",
      "retained_ref": {
        "path": ".latexmkrc",
        "sha256": "18199fd85e3e3c46ede9322a709e4f64e39470f69c6c20935e598d4c08adbc26"
      },
      "roles": [
        "receipt:tool-closure:.latexmkrc"
      ],
      "sha256": "18199fd85e3e3c46ede9322a709e4f64e39470f69c6c20935e598d4c08adbc26"
    },
    {
      "byte_count": 95,
      "path": "raw/source.json",
      "policy": "KEEP_IMMUTABLE",
      "retained_ref": {
        "path": "raw/source.json",
        "sha256": "6606d836718c6e60bbb721b458d023e4afdf94f1ce79295d1cbbb3d682727b4a"
      },
      "roles": [
        "upstream:discovery-raw:target-source",
        "upstream:x-raw:run-001"
      ],
      "sha256": "6606d836718c6e60bbb721b458d023e4afdf94f1ce79295d1cbbb3d682727b4a"
    },
    {
      "byte_count": 14629,
      "path": "schemas/dm022-preadoption-report-v2.schema.json",
      "policy": "KEEP_IMMUTABLE",
      "retained_ref": {
        "path": "schemas/dm022-preadoption-report-v2.schema.json",
        "sha256": "10238a1af7330e5352cbbad709e6360797fade789f184126f296fbeb3e82e4db"
      },
      "roles": [
        "receipt:tool-closure:schemas/dm022-preadoption-report-v2.schema.json"
      ],
      "sha256": "10238a1af7330e5352cbbad709e6360797fade789f184126f296fbeb3e82e4db"
    },
    {
      "byte_count": 8773,
      "path": "schemas/dm022-revision-manifest-v2.schema.json",
      "policy": "KEEP_IMMUTABLE",
      "retained_ref": {
        "path": "schemas/dm022-revision-manifest-v2.schema.json",
        "sha256": "e7534d019ec1b58672ff306ac901d65669e2c64251fe41964df2e81e356fbaf4"
      },
      "roles": [
        "receipt:tool-closure:schemas/dm022-revision-manifest-v2.schema.json"
      ],
      "sha256": "e7534d019ec1b58672ff306ac901d65669e2c64251fe41964df2e81e356fbaf4"
    },
    {
      "byte_count": 7403,
      "path": "schemas/dm022-revision-proof-v2.schema.json",
      "policy": "KEEP_IMMUTABLE",
      "retained_ref": {
        "path": "schemas/dm022-revision-proof-v2.schema.json",
        "sha256": "a79c09209c145d485ec39e1c1c277f0d706cf3ccfb0972c5bd9f6d6fe7cec5c3"
      },
      "roles": [
        "receipt:tool-closure:schemas/dm022-revision-proof-v2.schema.json"
      ],
      "sha256": "a79c09209c145d485ec39e1c1c277f0d706cf3ccfb0972c5bd9f6d6fe7cec5c3"
    },
    {
      "byte_count": 18648,
      "path": "schemas/dm022-revision-request-v2.schema.json",
      "policy": "KEEP_IMMUTABLE",
      "retained_ref": {
        "path": "schemas/dm022-revision-request-v2.schema.json",
        "sha256": "a99f0dc1f6e10ae5736063a051ef3b147eb85bccf20e435db87054a2bac1a31f"
      },
      "roles": [
        "receipt:tool-closure:schemas/dm022-revision-request-v2.schema.json"
      ],
      "sha256": "a99f0dc1f6e10ae5736063a051ef3b147eb85bccf20e435db87054a2bac1a31f"
    },
    {
      "byte_count": 7259,
      "path": "schemas/dm022-supersession-checkpoint-v2.schema.json",
      "policy": "KEEP_IMMUTABLE",
      "retained_ref": {
        "path": "schemas/dm022-supersession-checkpoint-v2.schema.json",
        "sha256": "fd39c246617293ecb6760906534512e2b5a14a484916c3d1f3ba055b33d3bec0"
      },
      "roles": [
        "receipt:tool-closure:schemas/dm022-supersession-checkpoint-v2.schema.json"
      ],
      "sha256": "fd39c246617293ecb6760906534512e2b5a14a484916c3d1f3ba055b33d3bec0"
    },
    {
      "byte_count": 2338,
      "path": "schemas/editorial-manuscript-spec-v2.schema.json",
      "policy": "KEEP_IMMUTABLE",
      "retained_ref": {
        "path": "schemas/editorial-manuscript-spec-v2.schema.json",
        "sha256": "043ce8a565385549265d6666642c2e3ec8ce0d8e8e5544a7eddfb32691478250"
      },
      "roles": [
        "receipt:tool-closure:schemas/editorial-manuscript-spec-v2.schema.json"
      ],
      "sha256": "043ce8a565385549265d6666642c2e3ec8ce0d8e8e5544a7eddfb32691478250"
    },
    {
      "byte_count": 2972,
      "path": "schemas/editorial-publication-build-record-v2.schema.json",
      "policy": "KEEP_IMMUTABLE",
      "retained_ref": {
        "path": "schemas/editorial-publication-build-record-v2.schema.json",
        "sha256": "b7c82476047373995cd5c4733ce2ba0b1c53fef72a84bceb26feec9078fea4ba"
      },
      "roles": [
        "receipt:tool-closure:schemas/editorial-publication-build-record-v2.schema.json"
      ],
      "sha256": "b7c82476047373995cd5c4733ce2ba0b1c53fef72a84bceb26feec9078fea4ba"
    },
    {
      "byte_count": 3107,
      "path": "schemas/editorial-publication-set-v2.schema.json",
      "policy": "KEEP_IMMUTABLE",
      "retained_ref": {
        "path": "schemas/editorial-publication-set-v2.schema.json",
        "sha256": "7beebcef48d7777144f7df7ce3fddc27c0d39df685fdc49cbfdd7d798c7e61e9"
      },
      "roles": [
        "receipt:tool-closure:schemas/editorial-publication-set-v2.schema.json"
      ],
      "sha256": "7beebcef48d7777144f7df7ce3fddc27c0d39df685fdc49cbfdd7d798c7e61e9"
    },
    {
      "byte_count": 3047,
      "path": "schemas/editorial-publication-source-manifest-v2.schema.json",
      "policy": "KEEP_IMMUTABLE",
      "retained_ref": {
        "path": "schemas/editorial-publication-source-manifest-v2.schema.json",
        "sha256": "494a1d152c76bca810d30e743d567210f130cb4197561d82b276f24ef69441bc"
      },
      "roles": [
        "receipt:tool-closure:schemas/editorial-publication-source-manifest-v2.schema.json"
      ],
      "sha256": "494a1d152c76bca810d30e743d567210f130cb4197561d82b276f24ef69441bc"
    },
    {
      "byte_count": 868,
      "path": "schemas/editorial-toolchain-spec-v2.schema.json",
      "policy": "KEEP_IMMUTABLE",
      "retained_ref": {
        "path": "schemas/editorial-toolchain-spec-v2.schema.json",
        "sha256": "50b5dc3ee05c496b2c2da13377c5ee0a883dfb52d9b9785189cb00a75d6e4db4"
      },
      "roles": [
        "receipt:tool-closure:schemas/editorial-toolchain-spec-v2.schema.json"
      ],
      "sha256": "50b5dc3ee05c496b2c2da13377c5ee0a883dfb52d9b9785189cb00a75d6e4db4"
    },
    {
      "byte_count": 3301,
      "path": "schemas/publication-candidate-v2.schema.json",
      "policy": "KEEP_IMMUTABLE",
      "retained_ref": {
        "path": "schemas/publication-candidate-v2.schema.json",
        "sha256": "a3fe0bc8dc21f79668e7017914f1e14b8933e1fb1cd7826c3a6515e01b42ed59"
      },
      "roles": [
        "receipt:tool-closure:schemas/publication-candidate-v2.schema.json"
      ],
      "sha256": "a3fe0bc8dc21f79668e7017914f1e14b8933e1fb1cd7826c3a6515e01b42ed59"
    },
    {
      "byte_count": 13479,
      "path": "schemas/publication-surface-revalidation.schema.json",
      "policy": "KEEP_IMMUTABLE",
      "retained_ref": {
        "path": "schemas/publication-surface-revalidation.schema.json",
        "sha256": "0376c7b43941c6b99d699996372572e04e9b4c98f495e5a5e3287163f37b23a5"
      },
      "roles": [
        "receipt:tool-closure:schemas/publication-surface-revalidation.schema.json"
      ],
      "sha256": "0376c7b43941c6b99d699996372572e04e9b4c98f495e5a5e3287163f37b23a5"
    },
    {
      "byte_count": 4229,
      "path": "schemas/quality-regression-bundle-v2.schema.json",
      "policy": "KEEP_IMMUTABLE",
      "retained_ref": {
        "path": "schemas/quality-regression-bundle-v2.schema.json",
        "sha256": "3aaf17255baba111d9f96dce2c90640380a38dbd691b82ac838eb7a33392c2bf"
      },
      "roles": [